{
  "version": 123,
  "updatedAt": 1793062949,
  "currency": "RMB",
  "usdExchangeRate": 7,
  "models": [
    {
      "modelId": "cursor-auto",
      "inputCostPerMillion": 8.75,
      "outputCostPerMillion": 42.0,
      "cacheReadCostPerMillion": 1.75,
      "cacheCreationCostPerMillion": 8.75,
      "contextTiers": [],
      "timeRules": [],
      "aliases": [
        "auto",
        "default"
      ],
      "aliasPatterns": [
        "^auto$",
        "^default$"
      ],
      "family": "spacex-ai"
    },
    {
      "modelId": "agent_review",
      "inputCostPerMillion": 3.5,
      "outputCostPerMillion": 17.5,
      "cacheReadCostPerMillion": 1.4,
      "cacheCreationCostPerMillion": 0.0,
      "contextTiers": [],
      "timeRules": [],
      "aliases": [
        "no-price-use-composer"
      ],
      "aliasPatterns": [
        "^no-price-use-composer$"
      ],
      "family": "spacex-ai"
    },
    {
      "modelId": "MiniMax-M2.7",
      "inputCostPerMillion": 2.1,
      "outputCostPerMillion": 8.4,
      "cacheReadCostPerMillion": 0.42,
      "cacheCreationCostPerMillion": 2.625,
      "contextTiers": [],
      "timeRules": [],
      "aliases": [
        "minimin-m2.7"
      ],
      "aliasPatterns": [
        "^minimin-m2\\.7$"
      ],
      "family": "minimax"
    },
    {
      "modelId": "MiniMax-M3",
      "inputCostPerMillion": 2.1,
      "outputCostPerMillion": 8.4,
      "cacheReadCostPerMillion": 0.42,
      "cacheCreationCostPerMillion": 0.0,
      "contextTiers": [
        {
          "threshold": 512000,
          "inputCostPerMillion": 4.2,
          "outputCostPerMillion": 16.8,
          "cacheReadCostPerMillion": 0.84,
          "cacheCreationCostPerMillion": 0.0
        }
      ],
      "timeRules": [],
      "aliases": [
        "minimax-m3-free"
      ],
      "aliasPatterns": [
        "^minimax-m3-free$"
      ],
      "family": "minimax"
    },
    {
      "modelId": "MiniMax-M3.1-Flash",
      "inputCostPerMillion": 1.0,
      "outputCostPerMillion": 4.0,
      "cacheReadCostPerMillion": 0.1,
      "cacheCreationCostPerMillion": 0.0,
      "dailySlots": [],
      "contextTiers": [],
      "timeRules": [],
      "aliases": [],
      "aliasPatterns": [
        "^minimax-m3\\.1-flash-preview$"
      ],
      "family": "minimax"
    },
    {
      "modelId": "Claude-3.5-Haiku",
      "inputCostPerMillion": 5.6,
      "outputCostPerMillion": 28.0,
      "cacheReadCostPerMillion": 0.56,
      "cacheCreationCostPerMillion": 7.0,
      "contextTiers": [],
      "timeRules": [],
      "aliases": [
        "claude-3-5-haiku-20241022"
      ],
      "aliasPatterns": [
        "^claude-3-5-haiku-20241022$"
      ],
      "family": "claude"
    },
    {
      "modelId": "Claude-3.5-Sonnet",
      "inputCostPerMillion": 21.0,
      "outputCostPerMillion": 105.0,
      "cacheReadCostPerMillion": 2.1,
      "cacheCreationCostPerMillion": 26.25,
      "contextTiers": [],
      "timeRules": [],
      "aliases": [
        "claude-3-5-sonnet-20241022"
      ],
      "aliasPatterns": [
        "^claude-3-5-sonnet-20241022$"
      ],
      "family": "claude"
    },
    {
      "modelId": "Claude-Haiku-4.5",
      "inputCostPerMillion": 7.0,
      "outputCostPerMillion": 35.0,
      "cacheReadCostPerMillion": 0.7,
      "cacheCreationCostPerMillion": 8.75,
      "contextTiers": [],
      "timeRules": [],
      "aliases": [
        "claude-haiku-4-5-20251001",
        "claude-haiku-4-5"
      ],
      "aliasPatterns": [
        "^claude-haiku-4-5-20251001$",
        "^claude-haiku-4-5$"
      ],
      "family": "claude"
    },
    {
      "modelId": "Claude-Haiku-5.5",
      "inputCostPerMillion": 0.7,
      "outputCostPerMillion": 3.5,
      "cacheReadCostPerMillion": 0.07,
      "cacheCreationCostPerMillion": 0.875,
      "dailySlots": [],
      "contextTiers": [
        {
          "threshold": 100000,
          "inputCostPerMillion": 3.5,
          "outputCostPerMillion": 17.5,
          "cacheReadCostPerMillion": 0.35,
          "cacheCreationCostPerMillion": 4.375
        }
      ],
      "timeRules": [],
      "aliases": [
        "claude-haiku-5-5",
        "claude-haiku-5-5-thinking-high",
        "claude-haiku-5-5-thinking-low",
        "claude-haiku-5-5-thinking-medium",
        "claude-haiku-5-5-thinking-extra-high",
        "claude-haiku-5-5-thinking-xhigh",
        "claude-haiku-5-5-thinking-max",
        "claude-haiku-5-5-high",
        "claude-haiku-5-5-low",
        "claude-haiku-5-5-medium",
        "claude-haiku-5-5-extra-high",
        "claude-haiku-5-5-xhigh",
        "claude-haiku-5-5-max"
      ],
      "aliasPatterns": [
        "^claude-haiku-5-5(-(thinking-)?(low|medium|high|extra-high|xhigh|max))?$"
      ],
      "family": "claude"
    },
    {
      "modelId": "Claude-Opus-4.1",
      "inputCostPerMillion": 105.0,
      "outputCostPerMillion": 525.0,
      "cacheReadCostPerMillion": 10.5,
      "cacheCreationCostPerMillion": 131.25,
      "contextTiers": [],
      "timeRules": [],
      "aliases": [
        "claude-opus-4-1-20250805"
      ],
      "aliasPatterns": [
        "^claude-opus-4-1-20250805$"
      ],
      "family": "claude"
    },
    {
      "modelId": "Claude-Opus-4",
      "inputCostPerMillion": 105.0,
      "outputCostPerMillion": 525.0,
      "cacheReadCostPerMillion": 10.5,
      "cacheCreationCostPerMillion": 131.25,
      "contextTiers": [],
      "timeRules": [],
      "aliases": [
        "claude-opus-4-20250514"
      ],
      "aliasPatterns": [
        "^claude-opus-4-20250514$"
      ],
      "family": "claude"
    },
    {
      "modelId": "Claude-Opus-4.5",
      "inputCostPerMillion": 35.0,
      "outputCostPerMillion": 175.0,
      "cacheReadCostPerMillion": 3.5,
      "cacheCreationCostPerMillion": 43.75,
      "contextTiers": [],
      "timeRules": [],
      "aliases": [
        "claude-opus-4-5-20251101"
      ],
      "aliasPatterns": [
        "^claude-opus-4-5-20251101$"
      ],
      "family": "claude"
    },
    {
      "modelId": "Claude-Opus-4.6",
      "inputCostPerMillion": 35.0,
      "outputCostPerMillion": 175.0,
      "cacheReadCostPerMillion": 3.5,
      "cacheCreationCostPerMillion": 43.75,
      "contextTiers": [],
      "timeRules": [],
      "aliases": [
        "claude-opus-4-6-20260206",
        "claude-opus-4-6-thinking"
      ],
      "aliasPatterns": [
        "^claude-opus-4-6-thinking$",
        "^claude-opus-4-6-20260206$"
      ],
      "family": "claude"
    },
    {
      "modelId": "Claude-Opus-4.7",
      "inputCostPerMillion": 35.0,
      "outputCostPerMillion": 175.0,
      "cacheReadCostPerMillion": 3.5,
      "cacheCreationCostPerMillion": 43.75,
      "contextTiers": [],
      "timeRules": [],
      "aliases": [
        "claude-opus-4-7"
      ],
      "aliasPatterns": [
        "^claude-opus-4-7$"
      ],
      "family": "claude"
    },
    {
      "modelId": "Claude-Opus-4.8",
      "inputCostPerMillion": 35.0,
      "outputCostPerMillion": 175.0,
      "cacheReadCostPerMillion": 3.5,
      "cacheCreationCostPerMillion": 43.75,
      "contextTiers": [],
      "timeRules": [],
      "aliases": [
        "claude-opus-4-8",
        "claude-opus-4-8-thinking-high",
        "claude-opus-4-8-thinking-low",
        "claude-opus-4-8-thinking-medium",
        "claude-opus-4-8-thinking-extra-high",
        "claude-opus-4-8-thinking-max"
      ],
      "aliasPatterns": [
        "^claude-opus-4-8-thinking(-(low|medium|high|extra-high|max))$",
        "^claude-opus-4-8$"
      ],
      "family": "claude"
    },
    {
      "modelId": "Claude-Opus-5",
      "inputCostPerMillion": 35.0,
      "outputCostPerMillion": 175.0,
      "cacheReadCostPerMillion": 3.5,
      "cacheCreationCostPerMillion": 43.75,
      "contextTiers": [],
      "timeRules": [],
      "aliases": [
        "claude-opus-5",
        "claude-opus-5-thinking-high",
        "claude-opus-5-thinking-low",
        "claude-opus-5-thinking-medium",
        "claude-opus-5-thinking-extra-high",
        "claude-opus-5-thinking-xhigh",
        "claude-opus-5-thinking-max"
      ],
      "aliasPatterns": [
        "^claude-opus-5-thinking(-(low|medium|high|extra-high|xhigh|max))$"
      ],
      "family": "claude"
    },
    {
      "modelId": "Claude-Opus-5.5",
      "inputCostPerMillion": 28.0,
      "outputCostPerMillion": 140.0,
      "cacheReadCostPerMillion": 1.4,
      "cacheCreationCostPerMillion": 35.0,
      "contextTiers": [],
      "timeRules": [],
      "aliases": [
        "claude-opus-5-5",
        "claude-opus-5-5-thinking-high",
        "claude-opus-5-5-thinking-low",
        "claude-opus-5-5-thinking-medium",
        "claude-opus-5-5-thinking-extra-high",
        "claude-opus-5-5-thinking-xhigh",
        "claude-opus-5-5-thinking-max",
        "claude-opus-5-5-high",
        "claude-opus-5-5-low",
        "claude-opus-5-5-medium",
        "claude-opus-5-5-extra-high",
        "claude-opus-5-5-xhigh",
        "claude-opus-5-5-max"
      ],
      "aliasPatterns": [
        "^claude-opus-5-5(-(thinking-)?(low|medium|high|extra-high|xhigh|max))?$"
      ],
      "family": "claude"
    },
    {
      "modelId": "Claude-Opus-5.5-Fast",
      "inputCostPerMillion": 56.0,
      "outputCostPerMillion": 280.0,
      "cacheReadCostPerMillion": 2.8,
      "cacheCreationCostPerMillion": 70.0,
      "contextTiers": [],
      "timeRules": [],
      "aliases": [
        "claude-opus-5-5-fast"
      ],
      "aliasPatterns": [
        "^claude-opus-5-5-fast$"
      ],
      "family": "claude"
    },
    {
      "modelId": "Claude-Sonnet-4",
      "inputCostPerMillion": 21.0,
      "outputCostPerMillion": 105.0,
      "cacheReadCostPerMillion": 2.1,
      "cacheCreationCostPerMillion": 26.25,
      "contextTiers": [],
      "timeRules": [],
      "aliases": [
        "claude-sonnet-4-20250514"
      ],
      "aliasPatterns": [
        "^claude-sonnet-4-20250514$"
      ],
      "family": "claude"
    },
    {
      "modelId": "Claude-Sonnet-4.5",